congress,chamber,session,roll_call,bill,date,democratic,description,independent,question,question_text,republican,result,source,time,total,url,vote_type,vote_uri
109,House,1,506,"{'bill_id': 'hr3824-109', 'number': 'H.R.3824', 'sponsor_id': 'P000419', 'api_uri': 'https://api.propublica.org/congress/v1/109/bills/hr3824.json', 'title': 'To amend and reauthorize the Endangered Species Act of 1973 to provide greater results conserving and recovering listed species, and for other purposes.', 'latest_action': 'Received in the Senate and Read twice and referred to the Committee on Environment and Public Works.'}",2005-09-29,"{'yes': 36, 'no': 158, 'present': 0, 'not_voting': 8, 'majority_position': 'No'}",Threatened and Endangered Species Recovery Act,"{'yes': 0, 'no': 1, 'present': 0, 'not_voting': 0}",On Passage,,"{'yes': 193, 'no': 34, 'present': 0, 'not_voting': 3, 'majority_position': 'Yes'}",Passed,http://clerk.house.gov/evs/2005/roll506.xml,17:12:00,"{'yes': 229, 'no': 193, 'present': 0, 'not_voting': 11}",http://clerk.house.gov/evs/2005/roll506.xml,RECORDED VOTE,https://api.propublica.org/congress/v1/109/house/sessions/1/votes/506.json
109,House,1,507,"{'bill_id': 'hjres68-109', 'number': 'H.J.RES.68', 'sponsor_id': 'L000274', 'api_uri': 'https://api.propublica.org/congress/v1/109/bills/hjres68.json', 'title': 'Making continuing appropriations for the fiscal year 2006, and for other purposes.', 'latest_action': 'Became Public Law No: 109-77.'}",2005-09-29,"{'yes': 129, 'no': 62, 'present': 0, 'not_voting': 11, 'majority_position': 'Yes'}","Making Continuing Appropriations for the Fiscal year 2006, and for other purposes","{'yes': 0, 'no': 1, 'present': 0, 'not_voting': 0}",On Passage,,"{'yes': 219, 'no': 2, 'present': 0, 'not_voting': 9, 'majority_position': 'Yes'}",Passed,http://clerk.house.gov/evs/2005/roll507.xml,17:20:00,"{'yes': 348, 'no': 65, 'present': 0, 'not_voting': 20}",http://clerk.house.gov/evs/2005/roll507.xml,YEA-AND-NAY,https://api.propublica.org/congress/v1/109/house/sessions/1/votes/507.json
109,House,1,508,"{'bill_id': 'hconres178-109', 'number': 'H.CON.RES.178', 'sponsor_id': 'N000159', 'api_uri': 'https://api.propublica.org/congress/v1/109/bills/hconres178.json', 'title': 'Recognizing the need to pursue research into the causes, a treatment, and an eventual cure for idiopathic pulmonary fibrosis, supporting the goals and ideals of National Idiopathic Pulmonary Fibrosis Awareness Week, and for other purposes.', 'latest_action': 'Received in the Senate and referred to the Committee on Health, Education, Labor, and Pensions.'}",2005-09-29,"{'yes': 182, 'no': 0, 'present': 0, 'not_voting': 20, 'majority_position': 'Yes'}","Recognizing the need to pursue research into the causes, a treatment, and an eventual cure for idiopathic pulmonary fibrosis, supporting the goals and ideals of National Idiopathic Fibrosis Awareness Week, and for other purposes","{'yes': 1, 'no': 0, 'present': 0, 'not_voting': 0}","On Motion to Suspend the Rules and Agree, as Amended",,"{'yes': 218, 'no': 0, 'present': 0, 'not_voting': 12, 'majority_position': 'Yes'}",Passed,http://clerk.house.gov/evs/2005/roll508.xml,17:30:00,"{'yes': 401, 'no': 0, 'present': 0, 'not_voting': 32}",http://clerk.house.gov/evs/2005/roll508.xml,2/3 YEA-AND-NAY,https://api.propublica.org/congress/v1/109/house/sessions/1/votes/508.json
109,House,1,509,"{'bill_id': 's1786-109', 'number': 'S.1786', 'sponsor_id': 'L000447', 'api_uri': 'https://api.propublica.org/congress/v1/109/bills/s1786.json', 'title': 'A bill to authorize the Secretary of Transportation to make emergency airport improvement project grants-in-aid under title 49, United States Code, for repairs and costs related to damage from Hurricanes Katrina and Rita.', 'latest_action': 'Became Public Law No: 109-87.'}",2005-10-06,"{'yes': 194, 'no': 0, 'present': 0, 'not_voting': 8, 'majority_position': 'Yes'}","To authorize the Secretary of Transportation to make emergency airport improvement project grants-in-aid under title 49, United States Code, for repairs and costs related to damage from Hurricanes Katrina and Rita","{'yes': 1, 'no': 0, 'present': 0, 'not_voting': 0}",On Motion to Suspend the Rules and Pass,,"{'yes': 225, 'no': 0, 'present': 0, 'not_voting': 5, 'majority_position': 'Yes'}",Passed,http://clerk.house.gov/evs/2005/roll509.xml,19:09:00,"{'yes': 420, 'no': 0, 'present': 0, 'not_voting': 13}",http://clerk.house.gov/evs/2005/roll509.xml,2/3 YEA-AND-NAY,https://api.propublica.org/congress/v1/109/house/sessions/1/votes/509.json
109,House,1,510,"{'bill_id': 'hres276-109', 'number': 'H.RES.276', 'sponsor_id': 'P000585', 'api_uri': 'https://api.propublica.org/congress/v1/109/bills/hres276.json', 'title': 'Supporting the goals and ideals of Pancreatic Cancer Awareness Month.', 'latest_action': 'Motion to reconsider laid on the table Agreed to without objection.'}",2005-10-06,"{'yes': 194, 'no': 0, 'present': 0, 'not_voting': 8, 'majority_position': 'Yes'}",Supporting the goals and ideals of Pancreatic Cancer Awareness Month,"{'yes': 1, 'no': 0, 'present': 0, 'not_voting': 0}",On Motion to Suspend the Rules and Agree,,"{'yes': 220, 'no': 0, 'present': 0, 'not_voting': 10, 'majority_position': 'Yes'}",Passed,http://clerk.house.gov/evs/2005/roll510.xml,19:17:00,"{'yes': 415, 'no': 0, 'present': 0, 'not_voting': 18}",http://clerk.house.gov/evs/2005/roll510.xml,2/3 YEA-AND-NAY,https://api.propublica.org/congress/v1/109/house/sessions/1/votes/510.json
109,House,1,511,"{'bill_id': 'hr3894-109', 'number': 'H.R.3894', 'sponsor_id': 'A000361', 'api_uri': 'https://api.propublica.org/congress/v1/109/bills/hr3894.json', 'title': 'To provide for waivers under certain housing assistance programs of the Department of Housing and Urban Development to assist victims of Hurricane Katrina and Hurricane Rita in obtaining housing.', 'latest_action': 'Referred to the Subcommittee on Housing and Community Opportunity.'}",2005-10-06,"{'yes': 194, 'no': 0, 'present': 0, 'not_voting': 8, 'majority_position': 'Yes'}",To provide waivers under certain housing assistance programs of the Department of Housing and Urban Development to assist victims of Hurricane Katrina in obtaining housing,"{'yes': 1, 'no': 0, 'present': 0, 'not_voting': 0}","On Motion to Suspend the Rules and Pass, as Amended",,"{'yes': 223, 'no': 0, 'present': 0, 'not_voting': 7, 'majority_position': 'Yes'}",Passed,http://clerk.house.gov/evs/2005/roll511.xml,19:26:00,"{'yes': 418, 'no': 0, 'present': 0, 'not_voting': 15}",http://clerk.house.gov/evs/2005/roll511.xml,2/3 YEA-AND-NAY,https://api.propublica.org/congress/v1/109/house/sessions/1/votes/511.json
109,House,1,512,"{'bill_id': 'hr2360-109', 'number': 'H.R.2360', 'sponsor_id': 'R000395', 'api_uri': 'https://api.propublica.org/congress/v1/109/bills/hr2360.json', 'title': 'Making appropriations for the Department of Homeland Security for the fiscal year ending September 30, 2006, and for other purposes.', 'latest_action': 'Became Public Law No: 109-90.'}",2005-10-06,"{'yes': 124, 'no': 67, 'present': 0, 'not_voting': 11, 'majority_position': 'Yes'}","Department of Homeland Security Appropriations, FY 2006","{'yes': 0, 'no': 1, 'present': 0, 'not_voting': 0}",On Agreeing to the Conference Report,,"{'yes': 223, 'no': 2, 'present': 0, 'not_voting': 5, 'majority_position': 'Yes'}",Passed,http://clerk.house.gov/evs/2005/roll512.xml,20:43:00,"{'yes': 347, 'no': 70, 'present': 0, 'not_voting': 16}",http://clerk.house.gov/evs/2005/roll512.xml,YEA-AND-NAY,https://api.propublica.org/congress/v1/109/house/sessions/1/votes/512.json
109,House,1,513,"{'bill_id': 'hr3895-109', 'number': 'H.R.3895', 'sponsor_id': 'B000072', 'api_uri': 'https://api.propublica.org/congress/v1/109/bills/hr3895.json', 'title': 'To amend title V of the Housing Act of 1949 to provide rural housing assistance to families affected by Hurricane Katrina or Hurricane Rita.', 'latest_action': 'Referred to the Subcommittee on Housing and Community Opportunity.'}",2005-10-06,"{'yes': 185, 'no': 5, 'present': 0, 'not_voting': 12, 'majority_position': 'Yes'}",To amend title V of the Housing Act of 1949 to provide rural housing assistance to families affected by Hurricane Katrina,"{'yes': 1, 'no': 0, 'present': 0, 'not_voting': 0}","On Motion to Suspend the Rules and Pass, as Amended",,"{'yes': 149, 'no': 76, 'present': 0, 'not_voting': 5, 'majority_position': 'Yes'}",Passed,http://clerk.house.gov/evs/2005/roll513.xml,20:53:00,"{'yes': 335, 'no': 81, 'present': 0, 'not_voting': 17}",http://clerk.house.gov/evs/2005/roll513.xml,2/3 YEA-AND-NAY,https://api.propublica.org/congress/v1/109/house/sessions/1/votes/513.json
109,House,1,514,"{'bill_id': 'hr3896-109', 'number': 'H.R.3896', 'sponsor_id': 'B000072', 'api_uri': 'https://api.propublica.org/congress/v1/109/bills/hr3896.json', 'title': 'To temporarily suspend, for communities affected by Hurricane Katrina or Hurricane Rita, certain requirements under the community development block grant program.', 'latest_action': 'Read twice and referred to the Committee on Banking, Housing, and Urban Affairs.'}",2005-10-06,"{'yes': 190, 'no': 0, 'present': 0, 'not_voting': 12, 'majority_position': 'Yes'}",Hurricane Katrina Emergency Relief CDBG Flexibility Act,"{'yes': 1, 'no': 0, 'present': 0, 'not_voting': 0}","On Motion to Suspend the Rules and Pass, as Amended",,"{'yes': 224, 'no': 0, 'present': 0, 'not_voting': 6, 'majority_position': 'Yes'}",Passed,http://clerk.house.gov/evs/2005/roll514.xml,21:01:00,"{'yes': 415, 'no': 0, 'present': 0, 'not_voting': 18}",http://clerk.house.gov/evs/2005/roll514.xml,2/3 YEA-AND-NAY,https://api.propublica.org/congress/v1/109/house/sessions/1/votes/514.json
109,House,1,515,"{'bill_id': 'hres481-109', 'number': 'H.RES.481', 'sponsor_id': 'D000299', 'api_uri': 'https://api.propublica.org/congress/v1/109/bills/hres481.json', 'title': 'Providing for the consideration of the bill (H.R. 3893) to expedite the construction of new refining capacity in the United States, to provide reliable and affordable energy for the American people, and for other purposes.', 'latest_action': 'The title of the measure was amended. Agreed to without objection.'}",2005-10-07,"{'yes': 0, 'no': 195, 'present': 0, 'not_voting': 7, 'majority_position': 'No'}","Providing for consideration of the bill (H.R. 3893) to expedite the construction of new refining capacity in the United States, to provide reliable and affordable energy for the American people, and for other purposes","{'yes': 0, 'no': 1, 'present': 0, 'not_voting': 0}",On Agreeing to the Resolution,,"{'yes': 216, 'no': 5, 'present': 0, 'not_voting': 9, 'majority_position': 'Yes'}",Passed,http://clerk.house.gov/evs/2005/roll515.xml,10:55:00,"{'yes': 216, 'no': 201, 'present': 0, 'not_voting': 16}",http://clerk.house.gov/evs/2005/roll515.xml,YEA-AND-NAY,https://api.propublica.org/congress/v1/109/house/sessions/1/votes/515.json
109,House,1,516,"{'bill_id': 'journal-109', 'number': 'JOURNAL', 'sponsor_id': None, 'api_uri': None, 'title': None, 'latest_action': None}",2005-10-07,"{'yes': 144, 'no': 47, 'present': 0, 'not_voting': 11, 'majority_position': 'Yes'}",,"{'yes': 1, 'no': 0, 'present': 0, 'not_voting': 0}",On Approving the Journal,,"{'yes': 203, 'no': 16, 'present': 0, 'not_voting': 11, 'majority_position': 'Yes'}",Passed,http://clerk.house.gov/evs/2005/roll516.xml,11:03:00,"{'yes': 348, 'no': 63, 'present': 0, 'not_voting': 22}",http://clerk.house.gov/evs/2005/roll516.xml,YEA-AND-NAY,https://api.propublica.org/congress/v1/109/house/sessions/1/votes/516.json
109,House,1,517,"{'bill_id': 'hr3893-109', 'number': 'H.R.3893', 'sponsor_id': 'B000213', 'api_uri': 'https://api.propublica.org/congress/v1/109/bills/hr3893.json', 'title': 'To expedite the construction of new refining capacity in the United States, to provide reliable and affordable energy for the American people, and for other purposes.', 'latest_action': 'Read twice and referred to the Committee on Energy and Natural Resources.'}",2005-10-07,"{'yes': 196, 'no': 0, 'present': 0, 'not_voting': 6, 'majority_position': 'Yes'}",Stupak of Michigan Substitute Amendment,"{'yes': 1, 'no': 0, 'present': 0, 'not_voting': 0}",On Agreeing to the Amendment,,"{'yes': 2, 'no': 222, 'present': 0, 'not_voting': 6, 'majority_position': 'No'}",Failed,http://clerk.house.gov/evs/2005/roll517.xml,13:32:00,"{'yes': 199, 'no': 222, 'present': 0, 'not_voting': 12}",http://clerk.house.gov/evs/2005/roll517.xml,RECORDED VOTE,https://api.propublica.org/congress/v1/109/house/sessions/1/votes/517.json
109,House,1,518,"{'bill_id': 'hr3893-109', 'number': 'H.R.3893', 'sponsor_id': 'B000213', 'api_uri': 'https://api.propublica.org/congress/v1/109/bills/hr3893.json', 'title': 'To expedite the construction of new refining capacity in the United States, to provide reliable and affordable energy for the American people, and for other purposes.', 'latest_action': 'Read twice and referred to the Committee on Energy and Natural Resources.'}",2005-10-07,"{'yes': 196, 'no': 0, 'present': 0, 'not_voting': 6, 'majority_position': 'Yes'}",Gasoline for America,"{'yes': 1, 'no': 0, 'present': 0, 'not_voting': 0}",On Motion to Recommit with Instructions,,"{'yes': 3, 'no': 222, 'present': 0, 'not_voting': 6, 'majority_position': 'No'}",Failed,http://clerk.house.gov/evs/2005/roll518.xml,13:58:00,"{'yes': 200, 'no': 222, 'present': 0, 'not_voting': 12}",http://clerk.house.gov/evs/2005/roll518.xml,RECORDED VOTE,https://api.propublica.org/congress/v1/109/house/sessions/1/votes/518.json
109,House,1,519,"{'bill_id': 'hr3893-109', 'number': 'H.R.3893', 'sponsor_id': 'B000213', 'api_uri': 'https://api.propublica.org/congress/v1/109/bills/hr3893.json', 'title': 'To expedite the construction of new refining capacity in the United States, to provide reliable and affordable energy for the American people, and for other purposes.', 'latest_action': 'Read twice and referred to the Committee on Energy and Natural Resources.'}",2005-10-07,"{'yes': 0, 'no': 196, 'present': 0, 'not_voting': 6, 'majority_position': 'No'}",Gasoline for America,"{'yes': 0, 'no': 1, 'present': 0, 'not_voting': 0}",On Passage,,"{'yes': 212, 'no': 13, 'present': 0, 'not_voting': 6, 'majority_position': 'Yes'}",Passed,http://clerk.house.gov/evs/2005/roll519.xml,14:42:00,"{'yes': 212, 'no': 210, 'present': 0, 'not_voting': 12}",http://clerk.house.gov/evs/2005/roll519.xml,RECORDED VOTE,https://api.propublica.org/congress/v1/109/house/sessions/1/votes/519.json
109,House,1,520,"{'bill_id': 'hconres248-109', 'number': 'H.CON.RES.248', 'sponsor_id': 'W000215', 'api_uri': 'https://api.propublica.org/congress/v1/109/bills/hconres248.json', 'title': 'Honoring the life and work of Simon Wiesenthal and reaffirming the commitment of Congress to the fight against anti-Semitism and intolerance in all forms, in all forums, and in all nations.', 'latest_action': 'Received in the Senate and referred to the Committee on Foreign Relations.'}",2005-10-07,"{'yes': 166, 'no': 0, 'present': 0, 'not_voting': 36, 'majority_position': 'Yes'}","Honoring the life and work of Simon Wiesenthal and reaffirming the commitment of Congress to the fight against anti-Semitism and intolerance in all forms, in all forums, and in all nations","{'yes': 1, 'no': 0, 'present': 0, 'not_voting': 0}","On Motion to Suspend the Rules and Agree, as Amended",,"{'yes': 187, 'no': 0, 'present': 0, 'not_voting': 43, 'majority_position': 'Yes'}",Passed,http://clerk.house.gov/evs/2005/roll520.xml,14:53:00,"{'yes': 354, 'no': 0, 'present': 0, 'not_voting': 79}",http://clerk.house.gov/evs/2005/roll520.xml,2/3 YEA-AND-NAY,https://api.propublica.org/congress/v1/109/house/sessions/1/votes/520.json
109,House,1,521,"{'bill_id': 'journal-109', 'number': 'JOURNAL', 'sponsor_id': None, 'api_uri': None, 'title': None, 'latest_action': None}",2005-10-17,"{'yes': 129, 'no': 35, 'present': 0, 'not_voting': 38, 'majority_position': 'Yes'}",,"{'yes': 0, 'no': 0, 'present': 0, 'not_voting': 1}",On Approving the Journal,,"{'yes': 188, 'no': 17, 'present': 1, 'not_voting': 24, 'majority_position': 'Yes'}",Passed,http://clerk.house.gov/evs/2005/roll521.xml,18:53:00,"{'yes': 317, 'no': 52, 'present': 1, 'not_voting': 63}",http://clerk.house.gov/evs/2005/roll521.xml,YEA-AND-NAY,https://api.propublica.org/congress/v1/109/house/sessions/1/votes/521.json
109,House,1,522,"{'bill_id': 'hres457-109', 'number': 'H.RES.457', 'sponsor_id': 'H001032', 'api_uri': 'https://api.propublica.org/congress/v1/109/bills/hres457.json', 'title': 'Recognizing the importance and positive contributions of chemistry to our everyday lives and supporting the goals and ideals of National Chemistry Week.', 'latest_action': 'Motion to reconsider laid on the table Agreed to without objection.'}",2005-10-17,"{'yes': 164, 'no': 0, 'present': 0, 'not_voting': 38, 'majority_position': 'Yes'}",Recognizing the importance and positive contributions of chemistry to our everyday lives and supporting the goals and ideals of National Chemistry Week,"{'yes': 0, 'no': 0, 'present': 0, 'not_voting': 1}",On Motion to Suspend the Rules and Agree,,"{'yes': 202, 'no': 2, 'present': 0, 'not_voting': 26, 'majority_position': 'Yes'}",Passed,http://clerk.house.gov/evs/2005/roll522.xml,19:04:00,"{'yes': 366, 'no': 2, 'present': 0, 'not_voting': 65}",http://clerk.house.gov/evs/2005/roll522.xml,2/3 YEA-AND-NAY,https://api.propublica.org/congress/v1/109/house/sessions/1/votes/522.json
109,House,1,523,"{'bill_id': 'hres491-109', 'number': 'H.RES.491', 'sponsor_id': 'B000586', 'api_uri': 'https://api.propublica.org/congress/v1/109/bills/hres491.json', 'title': 'Expressing the sense of the House of Representatives with respect to raising awareness and enhancing the state of computer security in the United States, and supporting the goals and ideals of National Cyber Security Awareness Month.', 'latest_action': 'Motion to reconsider laid on the table Agreed to without objection.'}",2005-10-17,"{'yes': 162, 'no': 0, 'present': 0, 'not_voting': 40, 'majority_position': 'Yes'}","Expressing the sense of the House of Representatives with respect to raising awareness and enhancing the state of computer security in the United States, and supporting the goals and ideals of National Cyber Security Awareness Month","{'yes': 0, 'no': 0, 'present': 0, 'not_voting': 1}",On Motion to Suspend the Rules and Agree,,"{'yes': 192, 'no': 13, 'present': 0, 'not_voting': 25, 'majority_position': 'Yes'}",Passed,http://clerk.house.gov/evs/2005/roll523.xml,19:20:00,"{'yes': 354, 'no': 13, 'present': 0, 'not_voting': 66}",http://clerk.house.gov/evs/2005/roll523.xml,2/3 YEA-AND-NAY,https://api.propublica.org/congress/v1/109/house/sessions/1/votes/523.json
109,House,1,524,"{'bill_id': 'hres494-109', 'number': 'H.RES.494', 'sponsor_id': 'G000550', 'api_uri': 'https://api.propublica.org/congress/v1/109/bills/hres494.json', 'title': ""Providing for consideration of the bill (H.R. 554) to prevent legislative and regulatory functions from being usurped by civil liability actions brought or continued against food manufacturers, marketers, distributors, advertisers, sellers, and trade associations for claims of injury relating to a person's weight gain, obesity, or any health condition associated with weight gain or obesity."", 'latest_action': 'Motion to reconsider laid on the table Agreed to without objection.'}",2005-10-18,"{'yes': 81, 'no': 114, 'present': 0, 'not_voting': 7, 'majority_position': 'No'}","Providing for the consideration on H.R. 554, Personal Responsibilty in Food Consumption Act","{'yes': 1, 'no': 0, 'present': 0, 'not_voting': 0}",On Agreeing to the Resolution,,"{'yes': 228, 'no': 0, 'present': 0, 'not_voting': 2, 'majority_position': 'Yes'}",Passed,http://clerk.house.gov/evs/2005/roll524.xml,17:53:00,"{'yes': 310, 'no': 114, 'present': 0, 'not_voting': 9}",http://clerk.house.gov/evs/2005/roll524.xml,YEA-AND-NAY,https://api.propublica.org/congress/v1/109/house/sessions/1/votes/524.json
109,House,1,525,"{'bill_id': 'hr1409-109', 'number': 'H.R.1409', 'sponsor_id': 'L000551', 'api_uri': 'https://api.propublica.org/congress/v1/109/bills/hr1409.json', 'title': 'To amend the Foreign Assistance Act of 1961 to provide assistance for orphans and other vulnerable children in developing countries, and for other purposes.', 'latest_action': 'Became Public Law No: 109-95.'}",2005-10-18,"{'yes': 195, 'no': 0, 'present': 0, 'not_voting': 7, 'majority_position': 'Yes'}",Assistance for Orphans and Other Vulnerable Children in Developing Countries Act of 2005,"{'yes': 1, 'no': 0, 'present': 0, 'not_voting': 0}","On Motion to Suspend the Rules and Pass, as Amended",,"{'yes': 219, 'no': 9, 'present': 0, 'not_voting': 2, 'majority_position': 'Yes'}",Passed,http://clerk.house.gov/evs/2005/roll525.xml,18:03:00,"{'yes': 415, 'no': 9, 'present': 0, 'not_voting': 9}",http://clerk.house.gov/evs/2005/roll525.xml,2/3 YEA-AND-NAY,https://api.propublica.org/congress/v1/109/house/sessions/1/votes/525.json
109,House,1,526,"{'bill_id': 'hres492-109', 'number': 'H.RES.492', 'sponsor_id': 'H001022', 'api_uri': 'https://api.propublica.org/congress/v1/109/bills/hres492.json', 'title': 'Mourning the loss of life caused by the earthquake that occurred on October 8, 2005, in Pakistan and India, expressing the condolences of the American people to the families of the victims, and urging assistance to those affected.', 'latest_action': 'Motion to reconsider laid on the table Agreed to without objection.'}",2005-10-18,"{'yes': 195, 'no': 0, 'present': 0, 'not_voting': 7, 'majority_position': 'Yes'}","Mourning the loss of life caused by the earthquake that occurred on October 8, 2005, in Pakistan and India, expressing the condolences of the American people to the families of the victims, and urging assistance to those affected.","{'yes': 1, 'no': 0, 'present': 0, 'not_voting': 0}",On Motion to Suspend the Rules and Agree,,"{'yes': 227, 'no': 0, 'present': 0, 'not_voting': 3, 'majority_position': 'Yes'}",Passed,http://clerk.house.gov/evs/2005/roll526.xml,18:11:00,"{'yes': 423, 'no': 0, 'present': 0, 'not_voting': 10}",http://clerk.house.gov/evs/2005/roll526.xml,2/3 YEA-AND-NAY,https://api.propublica.org/congress/v1/109/house/sessions/1/votes/526.json
109,House,1,527,"{'bill_id': 'hr3549-109', 'number': 'H.R.3549', 'sponsor_id': 'E000187', 'api_uri': 'https://api.propublica.org/congress/v1/109/bills/hr3549.json', 'title': ""To designate the facility of the United States Postal Service located at 210 West 3rd Avenue in Warren, Pennsylvania, as the 'William F. Clinger, Jr. Post Office Building'."", 'latest_action': 'Became Public Law No: 109-254.'}",2005-10-18,"{'yes': 193, 'no': 1, 'present': 0, 'not_voting': 8, 'majority_position': 'Yes'}","William F. Clinger, Jr. Post Office Building Designation","{'yes': 1, 'no': 0, 'present': 0, 'not_voting': 0}",On Motion to Suspend the Rules and Pass,,"{'yes': 228, 'no': 0, 'present': 0, 'not_voting': 2, 'majority_position': 'Yes'}",Passed,http://clerk.house.gov/evs/2005/roll527.xml,18:19:00,"{'yes': 422, 'no': 1, 'present': 0, 'not_voting': 10}",http://clerk.house.gov/evs/2005/roll527.xml,2/3 YEA-AND-NAY,https://api.propublica.org/congress/v1/109/house/sessions/1/votes/527.json
109,House,1,528,"{'bill_id': 'hr3853-109', 'number': 'H.R.3853', 'sponsor_id': 'R000573', 'api_uri': 'https://api.propublica.org/congress/v1/109/bills/hr3853.json', 'title': 'To designate the facility of the United States Postal Service located at 208 South Main Street in Parkdale, Arkansas, as the Willie Vaughn Post Office.', 'latest_action': 'Became Public Law No: 109-124.'}",2005-10-18,"{'yes': 193, 'no': 0, 'present': 0, 'not_voting': 9, 'majority_position': 'Yes'}",Willie Vaughn Post Office,"{'yes': 1, 'no': 0, 'present': 0, 'not_voting': 0}",On Motion to Suspend the Rules and Pass,,"{'yes': 227, 'no': 0, 'present': 0, 'not_voting': 3, 'majority_position': 'Yes'}",Passed,http://clerk.house.gov/evs/2005/roll528.xml,18:27:00,"{'yes': 421, 'no': 0, 'present': 0, 'not_voting': 12}",http://clerk.house.gov/evs/2005/roll528.xml,2/3 YEA-AND-NAY,https://api.propublica.org/congress/v1/109/house/sessions/1/votes/528.json
109,House,1,529,"{'bill_id': 'hr554-109', 'number': 'H.R.554', 'sponsor_id': 'K000361', 'api_uri': 'https://api.propublica.org/congress/v1/109/bills/hr554.json', 'title': ""To prevent legislative and regulatory functions from being usurped by civil liability actions brought or continued against food manufacturers, marketers, distributors, advertisers, sellers, and trade associations for claims of injury relating to a person's weight gain, obesity, or any health condition associated with weight gain or obesity."", 'latest_action': 'Read the second time. Placed on Senate Legislative Calendar under General Orders. Calendar No. 254.'}",2005-10-19,"{'yes': 66, 'no': 130, 'present': 0, 'not_voting': 6, 'majority_position': 'No'}",Jackson-Lee of Texas Amendment,"{'yes': 1, 'no': 0, 'present': 0, 'not_voting': 0}",On Agreeing to the Amendment,,"{'yes': 0, 'no': 227, 'present': 0, 'not_voting': 3, 'majority_position': 'No'}",Failed,http://clerk.house.gov/evs/2005/roll529.xml,12:28:00,"{'yes': 67, 'no': 357, 'present': 0, 'not_voting': 9}",http://clerk.house.gov/evs/2005/roll529.xml,RECORDED VOTE,https://api.propublica.org/congress/v1/109/house/sessions/1/votes/529.json
