congress,chamber,session,roll_call,bill,date,democratic,description,independent,question,question_text,republican,result,source,time,total,url,vote_type,vote_uri
106,House,2,437,"{'bill_id': 'hconres372-106', 'number': 'H.CON.RES.372', 'sponsor_id': 'C001037', 'api_uri': 'https://api.propublica.org/congress/v1/106/bills/hconres372.json', 'title': 'Expressing the sense of the Congress regarding the historic significance of the 210th anniversary of the establishment of the Coast Guard, and for other purposes.', 'latest_action': 'Received in the Senate and referred to the Committee on Commerce, Science, and Transportation.'}",2000-07-25,"{'yes': 202, 'no': 0, 'present': 0, 'not_voting': 9, 'majority_position': 'Yes'}",Expressing the Sense of Congress Concerning the 210th Anniversary of the Establishment of the Coast Guard,"{'yes': 2, 'no': 0, 'present': 0, 'not_voting': 0}",On Motion to Suspend the Rules and Agree,,"{'yes': 205, 'no': 0, 'present': 0, 'not_voting': 16, 'majority_position': 'Yes'}",Passed,http://clerk.house.gov/evs/2000/roll437.xml,20:36:00,"{'yes': 409, 'no': 0, 'present': 0, 'not_voting': 25}",http://clerk.house.gov/evs/2000/roll437.xml,2/3 YEA-AND-NAY,https://api.propublica.org/congress/v1/106/house/sessions/2/votes/437.json
106,House,2,438,"{'bill_id': 'hr4868-106', 'number': 'H.R.4868', 'sponsor_id': 'C000873', 'api_uri': 'https://api.propublica.org/congress/v1/106/bills/hr4868.json', 'title': 'To amend the Harmonized Tariff Schedule of the United States to modify temporarily certain rates of duty, to make other technical amendments to the trade laws, and for other purposes.', 'latest_action': 'Became Public Law No: 106-476'}",2000-07-25,"{'yes': 202, 'no': 0, 'present': 0, 'not_voting': 9, 'majority_position': 'Yes'}",Miscellaneous Trade and Technical Corrections Act,"{'yes': 2, 'no': 0, 'present': 0, 'not_voting': 0}","On Motion to Suspend the Rules and Pass, as Amended",,"{'yes': 207, 'no': 0, 'present': 0, 'not_voting': 14, 'majority_position': 'Yes'}",Passed,http://clerk.house.gov/evs/2000/roll438.xml,20:43:00,"{'yes': 411, 'no': 0, 'present': 0, 'not_voting': 23}",http://clerk.house.gov/evs/2000/roll438.xml,2/3 YEA-AND-NAY,https://api.propublica.org/congress/v1/106/house/sessions/2/votes/438.json
106,House,2,439,"{'bill_id': 'hr4033-106', 'number': 'H.R.4033', 'sponsor_id': 'V000108', 'api_uri': 'https://api.propublica.org/congress/v1/106/bills/hr4033.json', 'title': 'To amend the Omnibus Crime Control and Safe Streets Act of 1968 to clarify the procedures and conditions for the award of matching grants for the purchase of armor vests.', 'latest_action': 'Read the second time. Placed on Senate Legislative Calendar under General Orders. Calendar No. 777.'}",2000-07-26,"{'yes': 202, 'no': 0, 'present': 0, 'not_voting': 8, 'majority_position': 'Yes'}",Bulletproof Vest Partnership Grant Act,"{'yes': 2, 'no': 0, 'present': 0, 'not_voting': 0}","On Motion to Suspend the Rules and Pass, as Amended",,"{'yes': 209, 'no': 3, 'present': 0, 'not_voting': 10, 'majority_position': 'Yes'}",Passed,http://clerk.house.gov/evs/2000/roll439.xml,10:49:00,"{'yes': 413, 'no': 3, 'present': 0, 'not_voting': 18}",http://clerk.house.gov/evs/2000/roll439.xml,2/3 YEA-AND-NAY,https://api.propublica.org/congress/v1/106/house/sessions/2/votes/439.json
106,House,2,440,"{'bill_id': 'hr4710-106', 'number': 'H.R.4710', 'sponsor_id': 'L000096', 'api_uri': 'https://api.propublica.org/congress/v1/106/bills/hr4710.json', 'title': 'To authorize appropriations for the prosecution of obscenity cases.', 'latest_action': 'Referred to Senate committee. Status: Received in the Senate and Read twice and referred to the Committee on the Judiciary.'}",2000-07-26,"{'yes': 199, 'no': 3, 'present': 0, 'not_voting': 8, 'majority_position': 'Yes'}",Illegal Pornography Prosecution Act,"{'yes': 2, 'no': 0, 'present': 0, 'not_voting': 0}",On Motion to Suspend the Rules and Pass,,"{'yes': 211, 'no': 1, 'present': 0, 'not_voting': 10, 'majority_position': 'Yes'}",Passed,http://clerk.house.gov/evs/2000/roll440.xml,10:57:00,"{'yes': 412, 'no': 4, 'present': 0, 'not_voting': 18}",http://clerk.house.gov/evs/2000/roll440.xml,2/3 YEA-AND-NAY,https://api.propublica.org/congress/v1/106/house/sessions/2/votes/440.json
106,House,2,441,"{'bill_id': 'hjres99-106', 'number': 'H.J.RES.99', 'sponsor_id': 'R000409', 'api_uri': 'https://api.propublica.org/congress/v1/106/bills/hjres99.json', 'title': 'Disapproving the extension of the waiver authority contained in section 402(c) of the Trade Act of 1974 with respect to Vietnam.', 'latest_action': 'Failed of passage/not agreed to in House. Status: On passage Failed by the Yeas and Nays: 91 - 332 (Roll no. 441).'}",2000-07-26,"{'yes': 23, 'no': 184, 'present': 0, 'not_voting': 3, 'majority_position': 'No'}",Disapproving the extension of the waiver authority contained in section 402(c) of the Trade Act of 1974 with respect to Vietnam,"{'yes': 2, 'no': 0, 'present': 0, 'not_voting': 0}",On Passage,,"{'yes': 66, 'no': 148, 'present': 0, 'not_voting': 8, 'majority_position': 'No'}",Failed,http://clerk.house.gov/evs/2000/roll441.xml,12:35:00,"{'yes': 91, 'no': 332, 'present': 0, 'not_voting': 11}",http://clerk.house.gov/evs/2000/roll441.xml,YEA-AND-NAY,https://api.propublica.org/congress/v1/106/house/sessions/2/votes/441.json
106,House,2,442,"{'bill_id': 'hres563-106', 'number': 'H.RES.563', 'sponsor_id': 'L000321', 'api_uri': 'https://api.propublica.org/congress/v1/106/bills/hres563.json', 'title': 'Providing for consideration of the bill (H.R. 4942) making appropriations for the government of the District of Columbia and other activities chargeable in whole or in part against the revenues of said District for the fiscal year ending September 30, 2001, and for other purposes.', 'latest_action': 'Motion to reconsider laid on the table Agreed to without objection.'}",2000-07-26,"{'yes': 3, 'no': 201, 'present': 0, 'not_voting': 6, 'majority_position': 'No'}",Providing for consideration of H.R. 4942; Making Appropriations for the District of Columbia for F.Y. 2001,"{'yes': 1, 'no': 1, 'present': 0, 'not_voting': 0}",On Agreeing to the Resolution,,"{'yes': 213, 'no': 1, 'present': 0, 'not_voting': 8, 'majority_position': 'Yes'}",Passed,http://clerk.house.gov/evs/2000/roll442.xml,13:44:00,"{'yes': 217, 'no': 203, 'present': 0, 'not_voting': 14}",http://clerk.house.gov/evs/2000/roll442.xml,YEA-AND-NAY,https://api.propublica.org/congress/v1/106/house/sessions/2/votes/442.json
106,House,2,443,"{'bill_id': 'journal-106', 'number': 'JOURNAL', 'sponsor_id': None, 'api_uri': None, 'title': None, 'latest_action': None}",2000-07-27,"{'yes': 163, 'no': 37, 'present': 0, 'not_voting': 10, 'majority_position': 'Yes'}",,"{'yes': 2, 'no': 0, 'present': 0, 'not_voting': 0}",On Approving the Journal,,"{'yes': 179, 'no': 18, 'present': 0, 'not_voting': 25, 'majority_position': 'Yes'}",Passed,http://clerk.house.gov/evs/2000/roll443.xml,10:26:00,"{'yes': 344, 'no': 55, 'present': 0, 'not_voting': 35}",http://clerk.house.gov/evs/2000/roll443.xml,YEA-AND-NAY,https://api.propublica.org/congress/v1/106/house/sessions/2/votes/443.json
106,House,2,444,"{'bill_id': 'hr4205-106', 'number': 'H.R.4205', 'sponsor_id': 'S000718', 'api_uri': 'https://api.propublica.org/congress/v1/106/bills/hr4205.json', 'title': 'To authorize appropriations for fiscal year 2001 for military activities of the Department of Defense, for military construction, and for defense activities of the Department of Energy, to prescribe personnel strengths for such fiscal year for the Armed Forces, and for other purposes.', 'latest_action': 'Became Public Law No: 106-398'}",2000-07-27,"{'yes': 206, 'no': 0, 'present': 0, 'not_voting': 4, 'majority_position': 'Yes'}",Defense Authorization Act for Fiscal Year 2001,"{'yes': 2, 'no': 0, 'present': 0, 'not_voting': 0}",On Motion to Instruct Conferees,,"{'yes': 208, 'no': 2, 'present': 1, 'not_voting': 11, 'majority_position': 'Yes'}",Passed,http://clerk.house.gov/evs/2000/roll444.xml,10:54:00,"{'yes': 416, 'no': 2, 'present': 1, 'not_voting': 15}",http://clerk.house.gov/evs/2000/roll444.xml,YEA-AND-NAY,https://api.propublica.org/congress/v1/106/house/sessions/2/votes/444.json
106,House,2,445,"{'bill_id': 'hr4205-106', 'number': 'H.R.4205', 'sponsor_id': 'S000718', 'api_uri': 'https://api.propublica.org/congress/v1/106/bills/hr4205.json', 'title': 'To authorize appropriations for fiscal year 2001 for military activities of the Department of Defense, for military construction, and for defense activities of the Department of Energy, to prescribe personnel strengths for such fiscal year for the Armed Forces, and for other purposes.', 'latest_action': 'Became Public Law No: 106-398'}",2000-07-27,"{'yes': 197, 'no': 9, 'present': 0, 'not_voting': 4, 'majority_position': 'Yes'}",Defense Authorization Act for Fiscal Year 2001,"{'yes': 2, 'no': 0, 'present': 0, 'not_voting': 0}",On closing portions of the conference,,"{'yes': 212, 'no': 0, 'present': 0, 'not_voting': 10, 'majority_position': 'Yes'}",Passed,http://clerk.house.gov/evs/2000/roll445.xml,11:13:00,"{'yes': 411, 'no': 9, 'present': 0, 'not_voting': 14}",http://clerk.house.gov/evs/2000/roll445.xml,YEA-AND-NAY,https://api.propublica.org/congress/v1/106/house/sessions/2/votes/445.json
106,House,2,446,"{'bill_id': 'hres568-106', 'number': 'H.RES.568', 'sponsor_id': 'A000215', 'api_uri': 'https://api.propublica.org/congress/v1/106/bills/hres568.json', 'title': 'Raising a question of the privilege of the House pursuant to Article I, Section 7, of the U.S. Constitution.', 'latest_action': 'On motion to table the measure Agreed to by recorded vote: 213 - 212 (Roll no. 446).'}",2000-07-27,"{'yes': 1, 'no': 206, 'present': 0, 'not_voting': 3, 'majority_position': 'No'}","Raising a question of the privileges of the House pursuant to Article I, section 7 of the U.S. Constitution","{'yes': 1, 'no': 1, 'present': 0, 'not_voting': 0}",On Motion to Table,,"{'yes': 211, 'no': 5, 'present': 0, 'not_voting': 7, 'majority_position': 'Yes'}",Passed,http://clerk.house.gov/evs/2000/roll446.xml,11:52:00,"{'yes': 213, 'no': 212, 'present': 0, 'not_voting': 10}",http://clerk.house.gov/evs/2000/roll446.xml,RECORDED VOTE,https://api.propublica.org/congress/v1/106/house/sessions/2/votes/446.json
106,House,2,447,"{'bill_id': 'hres564-106', 'number': 'H.RES.564', 'sponsor_id': 'S000250', 'api_uri': 'https://api.propublica.org/congress/v1/106/bills/hres564.json', 'title': 'Providing for consideration of the bill (H.R. 4865) to amend the Internal Revenue Code of 1986 to repeal the 1993 income tax increase on Social Security benefits.', 'latest_action': 'Motion to reconsider laid on the table Agreed to without objection.'}",2000-07-27,"{'yes': 14, 'no': 194, 'present': 0, 'not_voting': 2, 'majority_position': 'No'}",Providing for consideration of H.R. 4865; Social Security Benefits Tax Relief Act,"{'yes': 1, 'no': 0, 'present': 0, 'not_voting': 1}",On Agreeing to the Resolution,,"{'yes': 217, 'no': 0, 'present': 0, 'not_voting': 6, 'majority_position': 'Yes'}",Passed,http://clerk.house.gov/evs/2000/roll447.xml,14:24:00,"{'yes': 232, 'no': 194, 'present': 0, 'not_voting': 9}",http://clerk.house.gov/evs/2000/roll447.xml,YEA-AND-NAY,https://api.propublica.org/congress/v1/106/house/sessions/2/votes/447.json
106,House,2,448,"{'bill_id': 'hres565-106', 'number': 'H.RES.565', 'sponsor_id': 'L000321', 'api_uri': 'https://api.propublica.org/congress/v1/106/bills/hres565.json', 'title': 'Waiving points of order against the conference report to accompany the bill (H.R. 4516) making appropriations for the Legislative Branch for the fiscal year ending September 30, 2001, and for other purposes.', 'latest_action': 'Motion to reconsider laid on the table Agreed to without objection.'}",2000-07-27,"{'yes': 1, 'no': 205, 'present': 0, 'not_voting': 4, 'majority_position': 'No'}","Waiving Points of Order Against the Conference Report on H.R. 4516, Legislative Branch Appropriations for FY 2001","{'yes': 1, 'no': 1, 'present': 0, 'not_voting': 0}",On Agreeing to the Resolution,,"{'yes': 212, 'no': 4, 'present': 1, 'not_voting': 6, 'majority_position': 'Yes'}",Passed,http://clerk.house.gov/evs/2000/roll448.xml,14:42:00,"{'yes': 214, 'no': 210, 'present': 1, 'not_voting': 10}",http://clerk.house.gov/evs/2000/roll448.xml,RECORDED VOTE,https://api.propublica.org/congress/v1/106/house/sessions/2/votes/448.json
106,House,2,449,"{'bill_id': 'hr4865-106', 'number': 'H.R.4865', 'sponsor_id': 'A000215', 'api_uri': 'https://api.propublica.org/congress/v1/106/bills/hr4865.json', 'title': 'To amend the Internal Revenue Code of 1986 to repeal the 1993 income tax increase on Social Security benefits.', 'latest_action': 'Referred to Senate committee. Status: Received in the Senate and Read twice and referred to the Committee on Finance.'}",2000-07-27,"{'yes': 167, 'no': 40, 'present': 0, 'not_voting': 3, 'majority_position': 'Yes'}",Pomeroy of North Dakota Substitute Amendment,"{'yes': 1, 'no': 1, 'present': 0, 'not_voting': 0}",On Agreeing to the Amendment,,"{'yes': 1, 'no': 215, 'present': 0, 'not_voting': 7, 'majority_position': 'No'}",Failed,http://clerk.house.gov/evs/2000/roll449.xml,17:32:00,"{'yes': 169, 'no': 256, 'present': 0, 'not_voting': 10}",http://clerk.house.gov/evs/2000/roll449.xml,YEA-AND-NAY,https://api.propublica.org/congress/v1/106/house/sessions/2/votes/449.json
106,House,2,450,"{'bill_id': 'hr4865-106', 'number': 'H.R.4865', 'sponsor_id': 'A000215', 'api_uri': 'https://api.propublica.org/congress/v1/106/bills/hr4865.json', 'title': 'To amend the Internal Revenue Code of 1986 to repeal the 1993 income tax increase on Social Security benefits.', 'latest_action': 'Referred to Senate committee. Status: Received in the Senate and Read twice and referred to the Committee on Finance.'}",2000-07-27,"{'yes': 52, 'no': 155, 'present': 0, 'not_voting': 3, 'majority_position': 'No'}",Social Security Benefits Tax Relief Act,"{'yes': 1, 'no': 1, 'present': 0, 'not_voting': 0}",On Passage,,"{'yes': 212, 'no': 3, 'present': 0, 'not_voting': 8, 'majority_position': 'Yes'}",Passed,http://clerk.house.gov/evs/2000/roll450.xml,17:48:00,"{'yes': 265, 'no': 159, 'present': 0, 'not_voting': 11}",http://clerk.house.gov/evs/2000/roll450.xml,RECORDED VOTE,https://api.propublica.org/congress/v1/106/house/sessions/2/votes/450.json
106,House,2,451,"{'bill_id': 'hr4884-106', 'number': 'H.R.4884', 'sponsor_id': 'K000288', 'api_uri': 'https://api.propublica.org/congress/v1/106/bills/hr4884.json', 'title': ""To redesignate the facility of the United States Postal Service located at 200 West 2nd Street in Royal Oak, Michigan, as the 'William S. Broomfield Post Office Building'."", 'latest_action': 'Became Public Law No: 106-342'}",2000-09-06,"{'yes': 192, 'no': 0, 'present': 0, 'not_voting': 18, 'majority_position': 'Yes'}","Designating the William S. Broomfield Post Office Building in Royal Oak, Michigan","{'yes': 2, 'no': 0, 'present': 0, 'not_voting': 0}",On Motion to Suspend the Rules and Pass,,"{'yes': 210, 'no': 0, 'present': 0, 'not_voting': 12, 'majority_position': 'Yes'}",Passed,http://clerk.house.gov/evs/2000/roll451.xml,18:23:00,"{'yes': 404, 'no': 0, 'present': 0, 'not_voting': 30}",http://clerk.house.gov/evs/2000/roll451.xml,2/3 YEA-AND-NAY,https://api.propublica.org/congress/v1/106/house/sessions/2/votes/451.json
106,House,2,452,"{'bill_id': 'hr4484-106', 'number': 'H.R.4484', 'sponsor_id': 'M000941', 'api_uri': 'https://api.propublica.org/congress/v1/106/bills/hr4484.json', 'title': ""To designate the facility of the United States Postal Service located at 500 North Washington Street in Rockville, Maryland, as the 'Everett Alvarez, Jr. Post Office Building'."", 'latest_action': 'Became Public Law No: 106-336'}",2000-09-06,"{'yes': 194, 'no': 0, 'present': 0, 'not_voting': 16, 'majority_position': 'Yes'}","Designating the Everett Alvarez, Jr. Post Office Building in Rockville, Maryland","{'yes': 2, 'no': 0, 'present': 0, 'not_voting': 0}",On Motion to Suspend the Rules and Pass,,"{'yes': 207, 'no': 0, 'present': 0, 'not_voting': 15, 'majority_position': 'Yes'}",Passed,http://clerk.house.gov/evs/2000/roll452.xml,18:33:00,"{'yes': 403, 'no': 0, 'present': 0, 'not_voting': 31}",http://clerk.house.gov/evs/2000/roll452.xml,2/3 YEA-AND-NAY,https://api.propublica.org/congress/v1/106/house/sessions/2/votes/452.json
106,House,2,453,"{'bill_id': 'hr4448-106', 'number': 'H.R.4448', 'sponsor_id': 'C000984', 'api_uri': 'https://api.propublica.org/congress/v1/106/bills/hr4448.json', 'title': ""To designate the facility of the United States Postal Service located at 3500 Dolfield Avenue in Baltimore, Maryland, as the 'Judge Robert Bernard Watts, Sr. Post Office Building'."", 'latest_action': 'Became Public Law No: 106-334'}",2000-09-06,"{'yes': 196, 'no': 0, 'present': 0, 'not_voting': 14, 'majority_position': 'Yes'}","Designating the Judge Robert Bernard Watts, Sr. Post Office Building in Baltimore, Maryland","{'yes': 2, 'no': 0, 'present': 0, 'not_voting': 0}",On Motion to Suspend the Rules and Pass,,"{'yes': 206, 'no': 0, 'present': 0, 'not_voting': 16, 'majority_position': 'Yes'}",Passed,http://clerk.house.gov/evs/2000/roll453.xml,18:41:00,"{'yes': 404, 'no': 0, 'present': 0, 'not_voting': 30}",http://clerk.house.gov/evs/2000/roll453.xml,2/3 YEA-AND-NAY,https://api.propublica.org/congress/v1/106/house/sessions/2/votes/453.json
106,House,2,454,"{'bill_id': 'hr4115-106', 'number': 'H.R.4115', 'sponsor_id': 'C000116', 'api_uri': 'https://api.propublica.org/congress/v1/106/bills/hr4115.json', 'title': 'To authorize appropriations for the United States Holocaust Memorial Museum, and for other purposes.', 'latest_action': 'Became Public Law No: 106-292'}",2000-09-07,"{'yes': 200, 'no': 0, 'present': 0, 'not_voting': 10, 'majority_position': 'Yes'}",United States Holocaust Memorial Museum Appropriations,"{'yes': 2, 'no': 0, 'present': 0, 'not_voting': 0}",On Passage,,"{'yes': 213, 'no': 1, 'present': 0, 'not_voting': 8, 'majority_position': 'Yes'}",Passed,http://clerk.house.gov/evs/2000/roll454.xml,11:29:00,"{'yes': 415, 'no': 1, 'present': 0, 'not_voting': 18}",http://clerk.house.gov/evs/2000/roll454.xml,YEA-AND-NAY,https://api.propublica.org/congress/v1/106/house/sessions/2/votes/454.json
106,House,2,455,"{'bill_id': 'hr4678-106', 'number': 'H.R.4678', 'sponsor_id': 'J000163', 'api_uri': 'https://api.propublica.org/congress/v1/106/bills/hr4678.json', 'title': 'To provide more child support money to families leaving welfare, to simplify the rules governing the assignment and distribution of child support collected by States on behalf of children, to improve the collection of child support, to promote marriage, and for other purposes.', 'latest_action': 'Referred to Senate committee. Status: Received in the Senate and Read twice and referred to the Committee on Finance.'}",2000-09-07,"{'yes': 160, 'no': 42, 'present': 1, 'not_voting': 7, 'majority_position': 'Yes'}",Scott of Virginia Amendment,"{'yes': 1, 'no': 1, 'present': 0, 'not_voting': 0}",On Agreeing to the Amendment,,"{'yes': 2, 'no': 214, 'present': 0, 'not_voting': 6, 'majority_position': 'No'}",Failed,http://clerk.house.gov/evs/2000/roll455.xml,13:23:00,"{'yes': 163, 'no': 257, 'present': 1, 'not_voting': 13}",http://clerk.house.gov/evs/2000/roll455.xml,RECORDED VOTE,https://api.propublica.org/congress/v1/106/house/sessions/2/votes/455.json
106,House,2,456,"{'bill_id': 'hr4678-106', 'number': 'H.R.4678', 'sponsor_id': 'J000163', 'api_uri': 'https://api.propublica.org/congress/v1/106/bills/hr4678.json', 'title': 'To provide more child support money to families leaving welfare, to simplify the rules governing the assignment and distribution of child support collected by States on behalf of children, to improve the collection of child support, to promote marriage, and for other purposes.', 'latest_action': 'Referred to Senate committee. Status: Received in the Senate and Read twice and referred to the Committee on Finance.'}",2000-09-07,"{'yes': 174, 'no': 30, 'present': 0, 'not_voting': 6, 'majority_position': 'Yes'}",Child Support Distribution Act,"{'yes': 1, 'no': 1, 'present': 0, 'not_voting': 0}",On Motion to Recommit with Instructions,,"{'yes': 0, 'no': 218, 'present': 0, 'not_voting': 4, 'majority_position': 'No'}",Failed,http://clerk.house.gov/evs/2000/roll456.xml,13:55:00,"{'yes': 175, 'no': 249, 'present': 0, 'not_voting': 10}",http://clerk.house.gov/evs/2000/roll456.xml,RECORDED VOTE,https://api.propublica.org/congress/v1/106/house/sessions/2/votes/456.json
106,House,2,457,"{'bill_id': 'hr4678-106', 'number': 'H.R.4678', 'sponsor_id': 'J000163', 'api_uri': 'https://api.propublica.org/congress/v1/106/bills/hr4678.json', 'title': 'To provide more child support money to families leaving welfare, to simplify the rules governing the assignment and distribution of child support collected by States on behalf of children, to improve the collection of child support, to promote marriage, and for other purposes.', 'latest_action': 'Referred to Senate committee. Status: Received in the Senate and Read twice and referred to the Committee on Finance.'}",2000-09-07,"{'yes': 197, 'no': 7, 'present': 0, 'not_voting': 6, 'majority_position': 'Yes'}",Child Support Distribution Act,"{'yes': 2, 'no': 0, 'present': 0, 'not_voting': 0}",On Passage,,"{'yes': 206, 'no': 11, 'present': 0, 'not_voting': 5, 'majority_position': 'Yes'}",Passed,http://clerk.house.gov/evs/2000/roll457.xml,14:12:00,"{'yes': 405, 'no': 18, 'present': 0, 'not_voting': 11}",http://clerk.house.gov/evs/2000/roll457.xml,YEA-AND-NAY,https://api.propublica.org/congress/v1/106/house/sessions/2/votes/457.json
106,House,2,458,"{'bill_id': 'hr8-106', 'number': 'H.R.8', 'sponsor_id': 'D000549', 'api_uri': 'https://api.propublica.org/congress/v1/106/bills/hr8.json', 'title': 'To amend the Internal Revenue Code of 1986 to phaseout the estate and gift taxes over a 10-year period.', 'latest_action': 'Failed of passage in House over veto. Status: On passage, the objections of the President to the contrary notwithstanding Failed by the Yeas and Nays: (2/3 required): 274 - 157 (Roll no. 458).'}",2000-09-07,"{'yes': 53, 'no': 155, 'present': 0, 'not_voting': 2, 'majority_position': 'No'}",Death Tax Elimination Act,"{'yes': 1, 'no': 1, 'present': 0, 'not_voting': 0}","Passage, Objections of the President Notwithstanding",,"{'yes': 220, 'no': 1, 'present': 0, 'not_voting': 2, 'majority_position': 'Yes'}",Failed,http://clerk.house.gov/evs/2000/roll458.xml,16:02:00,"{'yes': 274, 'no': 157, 'present': 0, 'not_voting': 4}",http://clerk.house.gov/evs/2000/roll458.xml,2/3 YEA-AND-NAY,https://api.propublica.org/congress/v1/106/house/sessions/2/votes/458.json
106,House,2,459,"{'bill_id': 'hr4844-106', 'number': 'H.R.4844', 'sponsor_id': 'S000394', 'api_uri': 'https://api.propublica.org/congress/v1/106/bills/hr4844.json', 'title': 'To modernize the financing of the railroad retirement system and to provide enhanced benefits to employees and beneficiaries.', 'latest_action': 'Placed on Senate Legislative Calendar under General Orders. Calendar No. 924.'}",2000-09-07,"{'yes': 198, 'no': 2, 'present': 0, 'not_voting': 10, 'majority_position': 'Yes'}",Railroad Retirement and Survivors,"{'yes': 2, 'no': 0, 'present': 0, 'not_voting': 0}","On Motion to Suspend the Rules and Pass, as Amended",,"{'yes': 191, 'no': 23, 'present': 0, 'not_voting': 8, 'majority_position': 'Yes'}",Passed,http://clerk.house.gov/evs/2000/roll459.xml,17:08:00,"{'yes': 391, 'no': 25, 'present': 0, 'not_voting': 18}",http://clerk.house.gov/evs/2000/roll459.xml,2/3 YEA-AND-NAY,https://api.propublica.org/congress/v1/106/house/sessions/2/votes/459.json
106,House,2,460,"{'bill_id': 'hr2090-106', 'number': 'H.R.2090', 'sponsor_id': 'G000439', 'api_uri': 'https://api.propublica.org/congress/v1/106/bills/hr2090.json', 'title': 'To direct the Secretary of Commerce to contract with the National Academy of Sciences to establish the Coordinated Oceanographic Program Advisory Panel to report to the Congress on the feasibility and social value of a coordinated oceanography program.', 'latest_action': 'Read the second time. Placed on Senate Legislative Calendar under General Orders. Calendar No. 806.'}",2000-09-12,"{'yes': 187, 'no': 0, 'present': 0, 'not_voting': 24, 'majority_position': 'Yes'}",Exploration of the Seas Act,"{'yes': 2, 'no': 0, 'present': 0, 'not_voting': 0}","On Motion to Suspend the Rules and Pass, as Amended",,"{'yes': 201, 'no': 8, 'present': 0, 'not_voting': 11, 'majority_position': 'Yes'}",Passed,http://clerk.house.gov/evs/2000/roll460.xml,18:48:00,"{'yes': 390, 'no': 8, 'present': 0, 'not_voting': 35}",http://clerk.house.gov/evs/2000/roll460.xml,2/3 YEA-AND-NAY,https://api.propublica.org/congress/v1/106/house/sessions/2/votes/460.json
106,House,2,461,"{'bill_id': 'hr4957-106', 'number': 'H.R.4957', 'sponsor_id': 'R000053', 'api_uri': 'https://api.propublica.org/congress/v1/106/bills/hr4957.json', 'title': 'To amend the Omnibus Parks and Public Lands Management Act of 1996 to extend the legislative authority for the Black Patriots Foundation to establish a commemorative work.', 'latest_action': 'Became Public Law No: 106-442'}",2000-09-12,"{'yes': 188, 'no': 0, 'present': 0, 'not_voting': 23, 'majority_position': 'Yes'}",Black Patriots Foundation Extension of Legislative Authority,"{'yes': 2, 'no': 0, 'present': 0, 'not_voting': 0}",On Motion to Suspend the Rules and Pass,,"{'yes': 208, 'no': 0, 'present': 0, 'not_voting': 12, 'majority_position': 'Yes'}",Passed,http://clerk.house.gov/evs/2000/roll461.xml,18:57:00,"{'yes': 398, 'no': 0, 'present': 0, 'not_voting': 35}",http://clerk.house.gov/evs/2000/roll461.xml,2/3 YEA-AND-NAY,https://api.propublica.org/congress/v1/106/house/sessions/2/votes/461.json
